{
  "graph_id": "graph_run_ho01_cfg_baseline",
  "graph_version": 1,
  "candidate_ref": "cand_79c608506d29",
  "nodes": [
    {
      "node_id": "node_00_analysis",
      "work_unit_id": "wu_run_ho01_cfg_baseline_root",
      "stage": "analysis",
      "depends_on": [],
      "executor_binding": {
        "executor_id": "exec_openrouter_glm",
        "routing_decision_ref": "rd_59da4759587f",
        "qualification_ref": "qual_openrouter_glm_repository_analysis",
        "selection_mode": "NORMAL_SELECTION",
        "harness_context": "development_harness",
        "harness_context_ref": "hctx_ho01_cfg_baseline_dev"
      }
    },
    {
      "node_id": "node_01_effect",
      "work_unit_id": "wu_run_ho01_cfg_baseline_root",
      "stage": "effect",
      "depends_on": [
        "node_00_analysis"
      ],
      "executor_binding": {
        "executor_id": "exec_unitera_execution_control_fixture",
        "routing_decision_ref": "rd_a515492ad704",
        "qualification_ref": "qual_unitera_execution_control_fixture_s2b",
        "selection_mode": "NORMAL_SELECTION",
        "harness_context": "development_harness",
        "harness_context_ref": "hctx_ho01_cfg_baseline_dev"
      }
    },
    {
      "node_id": "node_02_verification",
      "work_unit_id": "wu_run_ho01_cfg_baseline_root",
      "stage": "verification",
      "depends_on": [
        "node_01_effect"
      ],
      "executor_binding": {
        "executor_id": "exec_local_tests",
        "routing_decision_ref": "rd_84b58d949bf8",
        "qualification_ref": "qual_local_tests_deterministic_verification",
        "selection_mode": "NORMAL_SELECTION",
        "harness_context": "development_harness",
        "harness_context_ref": "hctx_ho01_cfg_baseline_dev"
      }
    }
  ],
  "immutable": true,
  "created_at": "2026-10-21T01:11:39.360Z"
}
